{
  "$schema": "https://json-schema.org/draft/2020-12/schema",
  "$id": "https://goobers.dev/schemas/result.schema.json",
  "title": "ResultEnvelope",
  "description": "The V0 stage result envelope the runner acts on; consumed by gates and telemetry (ARCHITECTURE.md \u00a75). Bulk outputs are artifact pointers; outputs carries scalars only.",
  "type": "object",
  "additionalProperties": false,
  "required": [
    "status"
  ],
  "properties": {
    "status": {
      "description": "Terminal business outcome reported by the stage.",
      "type": "string",
      "enum": [
        "success",
        "failure",
        "blocked",
        "no-work"
      ]
    },
    "outputs": {
      "type": "object",
      "description": "Small declared scalar values only. Anything larger is an artifact, referenced by pointer \u2014 state does not travel through outputs.",
      "additionalProperties": {
        "type": [
          "string",
          "number",
          "integer",
          "boolean",
          "null"
        ]
      }
    },
    "artifacts": {
      "description": "Content-addressed artifacts produced by the stage.",
      "type": "array",
      "items": {
        "$ref": "artifact-pointer.schema.json"
      }
    },
    "transcript": {
      "description": "Runner-captured transcript for this agentic attempt. Diagnostic only; unlike artifacts, it is not passed to downstream stages.",
      "$ref": "artifact-pointer.schema.json"
    },
    "summary": {
      "description": "Human-readable summary of the stage result.",
      "type": "string"
    },
    "metrics": {
      "description": "Numeric metrics emitted by the stage.",
      "type": "object",
      "additionalProperties": {
        "type": "number"
      }
    },
    "error": {
      "description": "Structured failure detail for failure results.",
      "$ref": "#/$defs/errorInfo"
    },
    "integrity": {
      "type": "string",
      "enum": [
        "trusted",
        "maintainer",
        "unapproved",
        "derived"
      ],
      "description": "Provenance of the content this stage produced: the weakest grade among the inputs it was admitted with. Downstream stages resolving inputsFrom grade against this, because outputs are bare scalars that carry no label of their own."
    }
  },
  "allOf": [
    {
      "comment": "A failure result must carry error detail.",
      "if": {
        "properties": {
          "status": {
            "const": "failure"
          }
        },
        "required": [
          "status"
        ]
      },
      "then": {
        "required": [
          "error"
        ]
      }
    }
  ],
  "$defs": {
    "errorInfo": {
      "type": "object",
      "additionalProperties": false,
      "required": [
        "code",
        "message"
      ],
      "properties": {
        "code": {
          "description": "Stable, machine-readable stage failure code.",
          "type": "string",
          "minLength": 1
        },
        "message": {
          "description": "Human-readable stage failure message.",
          "type": "string",
          "minLength": 1
        },
        "causes": {
          "description": "Ordered structured cause chain when the producer can preserve wrapped-error boundaries; absent for legacy or unavailable structure.",
          "type": "array",
          "items": {
            "$ref": "#/$defs/errorCause"
          }
        },
        "retryable": {
          "description": "Whether retrying the stage failure may succeed.",
          "type": "boolean"
        }
      }
    },
    "errorCause": {
      "type": "object",
      "additionalProperties": false,
      "properties": {
        "code": {
          "description": "Stable machine-readable code for this cause layer, when available.",
          "type": "string",
          "minLength": 1
        },
        "class": {
          "description": "Stable classification for this cause layer, when available.",
          "type": "string",
          "minLength": 1
        },
        "message": {
          "description": "Human-readable message for this cause layer.",
          "type": "string",
          "minLength": 1
        }
      },
      "anyOf": [
        { "required": ["code"] },
        { "required": ["class"] },
        { "required": ["message"] }
      ]
    }
  }
}
